<?xml version="1.0" encoding="UTF-8"?>
<partit xmlns:xsi="http://www.w3.org/2001/XMLSchema-instance" xsi:noNamespaceSchemaLocation="../ej9/exercici9.xsd">
  <equips>
    <local>
      <nom>Barcelona</nom>
      <gols>
        <jugador>Messi</jugador>
        <minut>10</minut>
      </gols>
      <gols>
        <jugador>Villa</jugador>
        <minut>80</minut>
      </gols>
      <targetes>
      <tgrogues>
        <jugador>Pique</jugador>
        <minut>30</minut>
      </tgrogues>
      <tgrogues>
        <jugador>Alba</jugador>
        <minut>75</minut>
      </tgrogues>
    </targetes>
    </local>
    <visitant>
      <nom>Real Madrid</nom>
      <gols>
        <jugador>Cristiano</jugador>
        <minut>20</minut>
      </gols>
      <gols>
        <jugador>Benzema</jugador>
        <minut>88</minut>
      </gols>
      <gols>
        <jugador>Ramos</jugador>
        <minut>90</minut>
      </gols>
      <targetes>
      <tgrogues>
        <jugador>Ramos</jugador>
        <minut>30</minut>
        </tgrogues>
        <tvermelles>
        <jugador>Pepe</jugador>
        <minut>79</minut>
      </tvermelles>
    </targetes>
    </visitant>
  </equips>

</partit>
